"72","J","Gonmadje, C; Doumenge, C; Sunderland, T; McKey, D",NA,NA,NA,"Gonmadje, Christelle; Doumenge, Charles; Sunderland, Terry; McKey, Doyle",NA,NA,"Environmental filtering determines patterns of tree species composition in small mountains of Atlantic Central African forests","ACTA OECOLOGICA-INTERNATIONAL JOURNAL OF ECOLOGY",NA,NA,"English","Article",NA,NA,NA,NA,NA,"Altitude; Atlantic central African forests; Distance from the ocean; Ordination analysis; Slope exposure; Tree species composition","RAIN-FOREST; FLORISTIC COMPOSITION; ECOSYSTEM SERVICES; PLANT DIVERSITY; BETA-DIVERSITY; CLIMATE; COMMUNITIES; SCALE; DISTRIBUTIONS; VEGETATION","The determinants of patterns of plant species composition on small mountains are poorly known, especially in Central Africa. We aimed here to identify variation in tree species composition throughout the Ngovayang Massif (southern Cameroon) and determine the relative contributions of environmental factors and spatial autocorrelation in shaping tree species composition. Vegetation surveys were conducted in fifteen 1-ha (100 m x 100 m) permanent plots established along a transect from lowland (200 m) to submontane forests (900 m) in which all trees with a diameter (dbh) >= 10 cm were inventoried. Data were investigated using ordination methods (Correspondence Analysis and Canonical Correspondence Analysis). At the local scale, the most important variable in determining tree species composition patterns was slope exposure, followed by distance from the ocean and altitude. Together, these environmental variables explained 28% of floristic variation among plots, and the spatial structure almost disappeared when the effects of these variables were removed. Spatial autocorrelation analysis showed that spatial variables (geographic coordinates of the plots) or geographic distance between plots explained only 1% of the total initial variance. Residual spatial variation not explained by the environmental variables probably reflects the history of vegetation and the effects of other climatic variables that were not included in this study. Floristic variation in the Ngovayang Massif is due to strong environmental heterogeneity. The sensitivity of floristic composition to environmental variables such as slope orientation and altitude suggests that tree species composition may shift with expected climate changes, such as changes in the movement of air masses, increase in mean annual temperatures or increasing severity of the dry season. Our study highlights the need for systematic on-the-ground measurements of climate variables in tropical montane areas in order to better understand the current climate regime and serve as a basis for modelling future changes.","[Gonmadje, Christelle] Univ Yaounde I, Dept Plant Biol, POB 812, Yaounde, Cameroon; [Gonmadje, Christelle; Doumenge, Charles] Univ Montpellier, CIRAD, Forets & Soc, F-34398 Montpellier, France; [Sunderland, Terry] Ctr Int Forestry Res CIFOR, POB 0113, Bobcd Bogor 16000, Indonesia; [Sunderland, Terry] Univ British Columbia, Fac Forestry, 2424 Main Mall, Vancouver, BC V6T 1Z4, Canada; [McKey, Doyle] CNRS 5175, UMR, Ctr Ecol Fonct & Evolut, 1919 Route Mende, F-34293 Montpellier, France","Gonmadje, C (corresponding author), Univ Yaounde I, Dept Plant Biol, POB 812, Yaounde, Cameroon.","cgonmadje@yahoo.fr","Sunderland, Terence/AAE-7851-2019","Sunderland, Terence/0000-0002-1985-9849","French Ministry of Foreign Affairs [374]; Centre de Cooperation Internationale en Recherche Agronomique pour le Developpement (CIRAD); Service de Cooperation et d'Action Culturelle (SCAC) of the French Embassy in Cameroon","We thank 'Sud Expert Plantes' (SEP No 374, a programme funded by the French Ministry of Foreign Affairs), the Centre de Cooperation Internationale en Recherche Agronomique pour le Developpement (CIRAD), and the Service de Cooperation et d'Action Culturelle (SCAC) of the French Embassy in Cameroon for financial assistance through research grants that made this study possible. We are grateful to N. Fauvet for his technical assistance in GIS and the preparation of the maps, and to V. Freycon, N. Picard, A. Fayolle, S. Gourlet-Fleury and C. Schmitt for valuable comments on earlier drafts of this article. Special thanks are extended to M. Sainge, P. Mambo, M. Elad, P. Mezili and J.-M. Onana, for their technical expertise on specimen identification in the field and at the National Herbarium of Cameroon. We thank the people of Ngovayang for allowing us to work on their land and for assisting us in fieldwork. Finally, constructive comments from previous reviewers improved the paper.",NA,91,3,3,0,8,"ELSEVIER","AMSTERDAM","RADARWEG 29, 1043 NX AMSTERDAM, NETHERLANDS","1146-609X","1873-6238",NA,"ACTA OECOL","Acta Oecol.-Int. J. Ecol.","JAN",2019,"94",NA,NA,NA,"SI",NA,"12","21",NA,"10.1016/j.actao.2018.04.001",NA,NA,10,"Ecology","Environmental Sciences & Ecology","HI9DG","WOS:000456754900003",NA,NA,NA,NA,"2021-09-23",NA
"73","J","Song, J; Wan, SQ; Piao, SL; Hui, DF; Hovenden, MJ; Ciais, P; Liu, YW; Liu, YZ; Zhong, MX; Zheng, MM; Ma, GG; Zhou, ZX; Ru, JY",NA,NA,NA,"Song, Jian; Wan, Shiqiang; Piao, Shilong; Hui, Dafeng; Hovenden, Mark J.; Ciais, Philippe; Liu, Yongwen; Liu, Yinzhan; Zhong, Mingxing; Zheng, Mengmei; Ma, Gaigai; Zhou, Zhenxing; Ru, Jingyi",NA,NA,"Elevated CO2 does not stimulate carbon sink in a semi-arid grassland","ECOLOGY LETTERS",NA,NA,"English","Article",NA,NA,NA,NA,NA,"Carbon cycle; climate warming; CO2 enrichment; forb; grass; increased precipitation; modelling; multi-factor experiment; nitrogen addition; species composition","TEMPERATE C3 GRASSLANDS; WATER-USE EFFICIENCY; ECOSYSTEM CARBON; PLANT-GROWTH; NITROGEN ADDITION; CLIMATE-CHANGE; SOIL-NITROGEN; MOJAVE DESERT; RESPONSES; DIOXIDE","Elevated CO2 is widely accepted to enhance terrestrial carbon sink, especially in arid and semi-arid regions. However, great uncertainties exist for the CO2 fertilisation effects, particularly when its interactions with other global change factors are considered. A four-factor (CO2, temperature, precipitation and nitrogen) experiment revealed that elevated CO2 did not affect either gross ecosystem productivity or ecosystem respiration, and consequently resulted in no changes of net ecosystem productivity in a semi-arid grassland despite whether temperature, precipitation and nitrogen were elevated or not. The observations could be primarily attributable to the offset of ecosystem carbon uptake by enhanced soil carbon release under CO2 enrichment. Our findings indicate that arid and semi-arid ecosystems may not be sensitive to CO2 enrichment as previously expected and highlight the urgent need to incorporate this mechanism into most IPCC carbon-cycle models for convincing projection of terrestrial carbon sink and its feedback to climate change.","[Song, Jian; Wan, Shiqiang; Liu, Yinzhan; Zhong, Mingxing; Zheng, Mengmei; Ma, Gaigai; Zhou, Zhenxing; Ru, Jingyi] Henan Univ, Sch Life Sci, Int Joint Res Lab Global Change Ecol, Kaifeng 475004, Henan, Peoples R China; [Song, Jian; Wan, Shiqiang] Hebei Univ, Coll Life Sci, Baoding 071002, Hebei, Peoples R China; [Piao, Shilong] Peking Univ, Coll Urban & Environm Sci, Sinofrench Inst Earth Syst Sci, Beijing 100871, Peoples R China; [Piao, Shilong] Chinese Acad Sci, Inst Tibetan Plateau Res, Key Lab Alpine Ecol & Biodivers, Beijing 100085, Peoples R China; [Piao, Shilong] Chinese Acad Sci, Ctr Excellence Tibetan Earth Sci, Beijing 100085, Peoples R China; [Hui, Dafeng] Tennessee State Univ, Dept Biol Sci, Nashville, TN 37209 USA; [Hovenden, Mark J.] Univ Tasmania, Sch Nat Sci, Biol Sci, Private Bag 55, Hobart, Tas 7001, Australia; [Ciais, Philippe] UVSQ, CNRS, CEA, Lab Sci Climat & Environm, Gif Sur Yvette, France; [Liu, Yongwen] Chinese Acad Sci, Inst Tibetan Plateau Res, Key Lab Alpine Ecol & Biodivers, Beijing 100101, Peoples R China","Wan, SQ (corresponding author), Henan Univ, Sch Life Sci, Int Joint Res Lab Global Change Ecol, Kaifeng 475004, Henan, Peoples R China.; Wan, SQ (corresponding author), Hebei Univ, Coll Life Sci, Baoding 071002, Hebei, Peoples R China.","swan@ibcas.ac.cn","Ciais, Philippe M/A-6840-2011; , /X-2681-2019; Liu, Yinzhan/AAC-2391-2021; Wan, Shiqiang/L-9166-2019; Zhou, Zhenxing/ABA-2159-2020; Wan, Shiqiang/B-5799-2009; Liu, Yongwen/O-7330-2015","Ciais, Philippe M/0000-0001-8560-4943; Zhou, Zhenxing/0000-0001-9208-0893; Wan, Shiqiang/0000-0003-0631-1232; Liu, Yongwen/0000-0002-9664-303X; Hui, Dafeng/0000-0002-5284-2897","National Natural Science Foundation of ChinaNational Natural Science Foundation of China (NSFC) [31430015, 31830012, 41030104/D0308]","The authors thank Juanjuan Han for her constructive suggestions in improving the manuscript, Haijun Yang, Tingjuan Wu, Qian Zhang, Pengshuai Shao, Fanglong Su, Yuan Miao, Hongyan Han, Ang Zhang, Tong Zhang, Jiajia Wang, Jiajia Zhang, and Guoyong Li for their help in the experiment construction and data measurements, and the staff at the Duolun Restoration Ecology Research Station, Institute of Botany, Chinese Academy of Sciences, for their help in maintaining the field facilities. This work was financially supported by the National Natural Science Foundation of China (31430015, 31830012, and 41030104/D0308).",NA,70,18,19,15,174,"WILEY","HOBOKEN","111 RIVER ST, HOBOKEN 07030-5774, NJ USA","1461-023X","1461-0248",NA,"ECOL LETT","Ecol. Lett.","MAR",2019,"22","3",NA,NA,NA,NA,"458","468",NA,"10.1111/ele.13202",NA,NA,11,"Ecology","Environmental Sciences & Ecology","HK3PT","WOS:000457829800004",30609167,NA,NA,NA,"2021-09-23",NA
"74","J","O'Connor, RS; Kunin, WE; Garratt, MPD; Potts, SG; Roy, HE; Andrews, C; Jones, CM; Peyton, JM; Savage, J; Harvey, MC; Morris, RKA; Roberts, SPM; Wright, I; Vanbergen, AJ; Carvell, C",NA,NA,NA,"O'Connor, Rory S.; Kunin, William E.; Garratt, Michael P. D.; Potts, Simon G.; Roy, Helen E.; Andrews, Christopher; Jones, Catherine M.; Peyton, Jodey M.; Savage, Joanna; Harvey, Martin C.; Morris, Roger K. A.; Roberts, Stuart P. M.; Wright, Ivan; Vanbergen, Adam J.; Carvell, Claire",NA,NA,"Monitoring insect pollinators and flower visitation: The effectiveness and feasibility of different survey methods","METHODS IN ECOLOGY AND EVOLUTION",NA,NA,"English","Article",NA,NA,NA,NA,NA,"abundance; bees; diversity; expertise; hoverflies; pan traps; pollinator monitoring; transects","CITIZEN SCIENCE; BEE; BIAS; HYMENOPTERA; APIFORMES; PATTERNS; DECLINES","The status of pollinating insects is of international concern, but knowledge of the magnitude and extent of declines is limited by a lack of systematic monitoring. Standardized protocols are urgently needed, alongside a better understanding of how different methods and recorders (data collectors) influence estimates of pollinator abundance and diversity. We compared two common methods for sampling wild pollinating insects (solitary bees, bumblebees and hoverflies), pan traps and transects, in surveys of 1 km countryside squares (agricultural and semi-natural habitats) and flowering crop fields across Great Britain, including the influence of local floral resources (nectar sugar availability or crop flower density) on the insects sampled. Further, we compared the performance of recorders with differing expertise (non-specialist research staff, taxonomic experts and non-expert volunteers) in applying methods. Pan traps and transects produced compositionally distinct samples of pollinator communities. In the wider countryside, pan traps sampled more species of solitary bee and hoverfly. In flowering crops, transects recorded a greater number of individual bumblebees, but fewer species. Across all taxonomic groups and countryside and crop samples, transects generally had lower rates of species accumulation per individual collected than pan traps. This demonstrates that differences between methods in estimating richness are not due to sampling effort alone. However, recorders possessing greater taxonomic expertise can produce species accumulation data from transects that are almost commensurate with pan trapping. The abundance and species richness of pollinators (except solitary bees) on transects in the wider countryside was positively related to the availability of estimated nectar sugar. In crops, pollinator abundance responses to flower densities were idiosyncratic according to crop type, but overall the response was positive and negative for transects and pan traps, respectively. Given these taxonomic and context-specific differences in method performance, we assess their suitability for monitoring pollinating insect communities and pollination services. We discuss the relevance of these findings within the context of achieving standardized, large-scale monitoring of pollinating insects.","[O'Connor, Rory S.; Garratt, Michael P. D.; Potts, Simon G.; Roberts, Stuart P. M.] Univ Reading, Sch Agr Policy & Dev, Ctr Agrienvironm Res, Reading, Berks, England; [O'Connor, Rory S.; Kunin, William E.; Jones, Catherine M.] Univ Leeds, Fac Biol Sci, Leeds, W Yorkshire, England; [Roy, Helen E.; Peyton, Jodey M.; Savage, Joanna; Harvey, Martin C.; Carvell, Claire] Ctr Ecol & Hydrol, Wallingford, Oxon, England; [Andrews, Christopher; Vanbergen, Adam J.] Ctr Ecol & Hydrol, Penicuik, Midlothian, Scotland; [Jones, Catherine M.] Buglife Invertebrate Conservat Trust, Peterborough, Cambs, England; [Morris, Roger K. A.] Commonside East, Mitcham, Surrey, England; [Wright, Ivan] Shotover Wildlife, Oxford, England; [Vanbergen, Adam J.] Univ Bourgogne Franche Comte, INRA, AgroSup Dijon, Agroecol, Dijon, France","O'Connor, RS (corresponding author), Univ Reading, Sch Agr Policy & Dev, Ctr Agrienvironm Res, Reading, Berks, England.; O'Connor, RS (corresponding author), Univ Leeds, Fac Biol Sci, Leeds, W Yorkshire, England.","r.oconnor@reading.ac.uk","Garratt, Michael/AAT-2259-2020; Vanbergen, Adam J./I-6863-2012; Andrews, Christopher/I-9297-2012; Potts, Simon/C-7250-2008","Vanbergen, Adam J./0000-0001-8320-5535; Garratt, Michael/0000-0002-0196-6013; Peyton, Jodey/0000-0002-8313-6194; Andrews, Christopher/0000-0003-2428-272X; Roy, Helen/0000-0001-6050-679X; Potts, Simon/0000-0002-2045-980X; Harvey, Martin/0000-0001-7512-2449","Biotechnology and Biological Sciences Research CouncilUK Research & Innovation (UKRI)Biotechnology and Biological Sciences Research Council (BBSRC) [BB/I000348/1]; Wellcome TrustWellcome TrustEuropean Commission [BB/I000348/1]; Department for Environment, Food and Rural AffairsDepartment for Environment, Food & Rural Affairs (DEFRA) [BB/I000348/1, WC1101]; Scottish Government [BB/I000348/1, WC1101]; Natural Environment Research CouncilUK Research & Innovation (UKRI)Natural Environment Research Council (NERC) [NE/R016429/1]","Biotechnology and Biological Sciences Research Council, Grant/Award Number: BB/I000348/1; Wellcome Trust, Grant/Award Number: BB/I000348/1; Department for Environment, Food and Rural Affairs, Grant/Award Number: BB/I000348/1 and WC1101; Scottish Government, Grant/Award Number: BB/I000348/1 and WC1101; Natural Environment Research Council, Grant/Award Number: NE/R016429/1",NA,41,23,23,19,105,"WILEY","HOBOKEN","111 RIVER ST, HOBOKEN 07030-5774, NJ USA","2041-210X","2041-2096",NA,"METHODS ECOL EVOL","Methods Ecol. Evol.","DEC",2019,"10","12",NA,NA,NA,NA,"2129","2140",NA,"10.1111/2041-210X.13292",NA,"SEP 2019",12,"Ecology","Environmental Sciences & Ecology","JS2TE","WOS:000490161700001",NA,"Green Accepted",NA,NA,"2021-09-23",NA
"75","J","Habtamu, T; Bekele, A; Ahmed, R; Gadisa, T; Birlie, B; Tolemariam, T; Belay, B",NA,NA,NA,"Habtamu, Tadesse; Bekele, Afework; Ahmed, Raya; Gadisa, Tsegaye; Birlie, Belay; Tolemariam, Taye; Belay, Berhanu",NA,NA,"Diets of the African Civet Civettictis civetta (Schreber, 1778) in selected coffee forest habitat, south-western Ethiopia","AFRICAN JOURNAL OF ECOLOGY",NA,NA,"English","Article",NA,NA,NA,NA,NA,"African civet; civetry; coffee forest; diet biomass; faecal analysis; feeding ecology","CARNIVORE DIET; SCAT","Feeding ecology of the African civet, Civettictis civetta (Schreber, 1778), was studied in selected coffee forest habitat for two seasons between December 2012 and October 2013. The study was conducted in Limu Seka district, south-west Ethiopia. Faecal analysis was employed to assess the diet spectrum, seasonal abundance and relative importance of food items. Over 55 different food items were identified from the analysis of 387 scat samples collected during the dry and wet seasons. In the coffee forest habitat, African civets showed omnivorous feeding habit with plant-to-animal diet biomass ratio of 1:1.36. A slight diet specialization was observed during the wet season (BA=0.46) favouring animal prey. However, during the dry season, they showed generalist feeding habit (BA=0.87) with more plant biomass in their diet. With over 64% occurrence and 14.4% biomass, coffee berries significantly contributed to the civets dry season plant diets. The excreted coffee beans, after civets ingested ripe coffee berries, are the tastiest product used by farmers for consumption and market. Seasonal collection of civet coffee from coffee forest floor economically supports the farmers while increasing the importance of civets in the habitat and hence contributing for its conservation.","[Habtamu, Tadesse] Mettu Univ, Dept Biol, Mettu 318, Ethiopia; [Bekele, Afework] Addis Ababa Univ, Dept Zool Sci, Addis Ababa 1176, Ethiopia; [Ahmed, Raya] Jimma Agr Mech Res Ctr, Jimma 256, Ethiopia; [Gadisa, Tsegaye] Jimma Univ, Dept Biol, Jimma 378, Ethiopia; [Birlie, Belay] Jimma Univ, Dept Stat, Jimma 378, Ethiopia; [Tolemariam, Taye; Belay, Berhanu] Jimma Univ, Coll Agr & Vet Med, Jimma 378, Ethiopia","Habtamu, T (corresponding author), Mettu Univ, Dept Biol, Mettu 318, Ethiopia.","habtamu_tadese@yahoo.com",NA,"Birlie, Belay/0000-0001-8621-6539","Animal Diversity Thematic Research, Addis Ababa University","We sincerely thank the Animal Diversity Thematic Research, Addis Ababa University, for funding the research and Jimma University for the laboratory facilities. We appreciate the support from Seifu Tadesse during the field work.",NA,41,1,1,0,11,"WILEY","HOBOKEN","111 RIVER ST, HOBOKEN 07030-5774, NJ USA","0141-6707","1365-2028",NA,"AFR J ECOL","Afr. J. Ecol.","DEC",2017,"55","4",NA,NA,NA,NA,"573","579",NA,"10.1111/aje.12390",NA,NA,7,"Ecology","Environmental Sciences & Ecology","FN1IF","WOS:000415740100019",NA,NA,NA,NA,"2021-09-23",NA
"76","J","Proffitt, KM; Goldberg, JF; Hebblewhite, M; Russell, R; Jimenez, BS; Robinson, HS; Pilgrim, K; Schwartz, MK",NA,NA,NA,"Proffitt, K. M.; Goldberg, J. F.; Hebblewhite, M.; Russell, R.; Jimenez, B. S.; Robinson, H. S.; Pilgrim, K.; Schwartz, M. K.",NA,NA,"Integrating resource selection into spatial capture-recapture models for large carnivores","ECOSPHERE",NA,NA,"English","Article",NA,NA,NA,NA,NA,"Bayesian; carnivore; mountain lion; non-invasive; population estimation; Puma concolor; SCR","DENSITY-ESTIMATION; MOUNTAIN LIONS; INFERENCE; PARAMETERS; FRAMEWORK; ABUNDANCE; DYNAMICS","Wildlife managers need reliable methods to estimate large carnivore densities and population trends; yet large carnivores are elusive, difficult to detect, and occur at low densities making traditional approaches intractable. Recent advances in spatial capture-recapture (SCR) models have provided new approaches for monitoring trends in wildlife abundance and these methods are particularly applicable to large carnivores. We applied SCR models in a Bayesian framework to estimate mountain lion densities in the Bitterroot Mountains of west central Montana. We incorporate an existing resource selection function (RSF) as a density covariate to account for heterogeneity in habitat use across the study area and include data collected from harvested lions. We identify individuals through DNA samples collected by (1) biopsy darting mountain lions detected in systematic surveys of the study area, (2) opportunistically collecting hair and scat samples, and (3) sampling all harvested mountain lions. We included 80 DNA samples collected from 62 individuals in the analysis. Including information on predicted habitat use as a covariate on the distribution of activity centers reduced the median estimated density by 44%, the standard deviation by 7%, and the width of 95% credible intervals by 10% as compared to standard SCR models. Within the two management units of interest, we estimated a median mountain lion density of 4.5 mountain lions/100 km 2 (95% CI = 2.9, 7.7) and 5.2 mountain lions/100 km(2) (95% CI = 3.4, 9.1). Including harvested individuals (dead recovery) did not create a significant bias in the detection process by introducing individuals that could not be detected after removal. However, the dead recovery component of the model did have a substantial effect on results by increasing sample size. The ability to account for heterogeneity in habitat use provides a useful extension to SCR models, and will enhance the ability of wildlife managers to reliably and economically estimate density of wildlife populations, particularly large carnivores.","[Proffitt, K. M.] Montana Fish Wildlife & Pk, Bozeman, MT 59718 USA; [Goldberg, J. F.; Hebblewhite, M.] Univ Montana, Coll Forestry & Conservat, Dept Ecosyst & Conservat Sci, Wildlife Biol Program, Missoula, MT 59812 USA; [Jimenez, B. S.] Montana Fish Wildlife & Pk, Missoula, MT 59804 USA; [Russell, R.] US Geol Survey, Natl Wildlife Hlth Ctr, Madison, WI 53711 USA; [Robinson, H. S.] Panthera, New York, NY 10018 USA; [Pilgrim, K.; Schwartz, M. K.] US Forest Serv, USDA, Rocky Mt Res Stn, Missoula, MT 59801 USA","Proffitt, KM (corresponding author), Montana Fish Wildlife & Pk, 1400 South 19th St, Bozeman, MT 59718 USA.","kproffitt@mt.gov","hebblewhite, mark/G-6164-2013","Russell, Robin/0000-0001-8726-7303","Ravalli County Fish and Wildlife Association; Montana Outdoor Legacy Foundation; Western Montana Chapter of the Safari Club International; Safari Club International Foundation; Rocky Mountain Elk Foundation; University of Montana; U.S.D.A. Cooperative State Research, Education and Extension Service Grant [MONZ-1106]; sale of hunting and fishing licenses in Montana and Montana Fish, Wildlife and Parks Federal Aid in Wildlife Restoration grants","Project funding and support was provided by Ravalli County Fish and Wildlife Association, the Montana Outdoor Legacy Foundation, Western Montana Chapter of the Safari Club International, Safari Club International Foundation, Rocky Mountain Elk Foundation, the University of Montana, U.S.D.A. Cooperative State Research, Education and Extension Service Grant No. MONZ-1106, and by the sale of hunting and fishing licenses in Montana and Montana Fish, Wildlife and Parks Federal Aid in Wildlife Restoration grants. We thank R. Beausoleil for advice regarding field methodology, and J. A. Royle for expert advice on SCR modelling. We thank the project houndsmen and field staff for their dedicated efforts and expertise. Any use of trade, product, or firm names are for descriptive purposes only and do not imply endorsement by the U.S. Government.",NA,35,35,36,0,39,"WILEY","HOBOKEN","111 RIVER ST, HOBOKEN 07030-5774, NJ USA","2150-8925",NA,NA,"ECOSPHERE","Ecosphere","NOV",2015,"6","11",NA,NA,NA,NA,NA,NA,"239","10.1890/ES15-00001.1",NA,NA,15,"Ecology","Environmental Sciences & Ecology","CZ7WH","WOS:000367310600030",NA,"Green Published, gold",NA,NA,"2021-09-23",NA
