"54","J","Mayer, R; Erschbamer, B",NA,NA,NA,"Mayer, Roland; Erschbamer, Brigitta",NA,NA,"Long-term effects of grazing on subalpine and alpine grasslands in the Central Alps, Austria","BASIC AND APPLIED ECOLOGY",NA,NA,"English","Article",NA,NA,NA,NA,NA,"Elevation gradient; Exclusion; Frequency; Ordinations; Permanent plots","LAND-USE CHANGES; PLANT-SPECIES DIVERSITY; MOUNTAIN VEGETATION; GLACIER VALLEY; RICHNESS; EXCLUSION; CLIMATE; HISTORY; TRAITS; EUROPE","The effects of grazing exclusion on species diversity and functional diversity were analyzed along an elevation gradient from the subalpine (1960 m a.s.l) to the lower and upper alpine zone (2275 in-2650 m a.s.l) in the Austrian Central Alps for 15 years. Nine sites were chosen, including grasslands at different elevations, a bog and a glacier foreland site at the lower alpine zone and a snowbed at the upper alpine zone. Data were acquired by frequency counts in 1 m(2) permanent plots inside each fenced area (three plots per site) and outside in grazed areas (three plots), Diversity indices and functional diversity were analyzed by means of generalized linear mixed models (GLMMs), Exclosure, duration of exclusion and exclosureyears (interaction effect) were defined as predictor variables, Multivariate ordination techniques were used to (i) determine species responses to grazing exclusion (pRDA, partial redundancy analysis) and (ii) to create a distance matrix representing the changes between exclosures and control plots per year (NMDS, non-metric multidimensional scaling). At the subalpine grassland, first differences between exclosure and control plots occurred already only after three years, at the upper alpine zone after four and five years. Contrary to our expectation, dwarf shrubs did not increase within the exclosures of the subalpine grassland. Instead, mainly the tall forb Geranium sylvaticuin increased. Species richness significantly decreased at the exclosures of the subalpine zone, the snowbed and at one upper alpine grassland sites. The communities of the glacier foreland and the hog were hardly affected by grazing exclusion. We conclude that plant species and communities react individually depending on elevation and grazing animals. Grazi exclusion studies at high elevations should definitely be carried out in the long-term, (C) 2017 Gesellschaft lift. Okologie. Published by Elsevier GmbH. All rights reserved,","[Mayer, Roland; Erschbamer, Brigitta] Univ Innsbruck, Inst Bot, Sternwartestr 15, A-6020 Innsbruck, Austria","Erschbamer, B (corresponding author), Univ Innsbruck, Inst Bot, Sternwartestr 15, A-6020 Innsbruck, Austria.","brigitta.erschbamer@uibk.ac.at",NA,NA,"Environment Dept. of the Tyrolean Federal State Government; Austrian Academy of Science (OAW, MAR Programme); Mountain Agriculture Research LJnit/University of Innsbruck; Alpine Research Centre Obergurgl","The initial phase of the study was financially, supported by the Environment Dept. of the Tyrolean Federal State Government. We highly acknowledge the funding by the Austrian Academy of Science (OAW, MAR Programme) and the Mountain Agriculture Research LJnit/University of Innsbruck. We thank Ao.Univ.-Prof. Dr. Rudiger Kaufmann who was one of the initiators of the monitoring project. and we acknowledge the support by the Alpine Research Centre Obergurgl. We are grateful to two anonymous reviewer and Dr. Hovemeyer for their highly valuable comments.",NA,57,5,5,3,54,"ELSEVIER GMBH","MUNICH","HACKERBRUCKE 6, 80335 MUNICH, GERMANY","1439-1791","1618-0089",NA,"BASIC APPL ECOL","Basic Appl. Ecol.","NOV",2017,"24",NA,NA,NA,NA,NA,"9","18",NA,"10.1016/j.baae.2017.07.005",NA,NA,10,"Ecology","Environmental Sciences & Ecology","FN8KC","WOS:000416272400002",NA,NA,NA,NA,"2021-09-23",NA
"55","J","Norevik, G; Boano, G; Hedenstrom, A; Lardelli, R; Liechti, F; Akesson, S",NA,NA,NA,"Norevik, Gabriel; Boano, Giovanni; Hedenstrom, Anders; Lardelli, Roberto; Liechti, Felix; Akesson, Susanne",NA,NA,"Highly mobile insectivorous swifts perform multiple intra-tropical migrations to exploit an asynchronous African phenology","OIKOS",NA,NA,"English","Article",NA,NA,NA,NA,NA,"insectivorous bird; intra-tropical migration; phenology","EAST-NATIONAL-PARK; WEST-AFRICA; BIRDS; MIGRANTS; STRATEGIES; MOVEMENTS; BIOMASS; SEASON; NDVI; MOLT","With timely allocated movement phases, mobile organisms can match their space-use with the seasonality of the environment and thereby optimise their resource utilisation over time. Long-distance avian migrants are known to move with the seasonal dynamics on an annual basis, but how individuals respond to seasonality within their tropical non-breeding range has been less studied. Here we analyse the movement pattern of a highly mobile aerial insectivorous bird, the pallid swift Apus pallidus, and its association with the local habitat phenology during the non-breeding period, using individual-based light-level geolocation. We extracted timing and location of 21 birds' residence periods, as well as characteristics of the intervening movements, such as distance and speed. We used time series of precipitation and vegetation data for each residence area to extract the timing of the local end of the rainy season and the onset of the dry season. The pallid swifts repeatedly upgraded their habitat by undertaking 2-5 intra-tropical migrations correlated with the withdrawal of the rains and the onset of the local dry season. The birds arrived to the sites on average 12 days after rains ended and departed about two weeks after the onset of dry season suggesting that the birds closely tracked a spatiotemporal window presumably timed with optimal foraging conditions. Our results provide insights in the ways Palaearctic-African migrants respond to the asynchronous phenology within their sub-Saharan non-breeding range. We confirmed that pallid swifts actively respond to deteriorating conditions by repeated upgrades in habitat quality, which likely have substantial consequences for an individual's access to an essential, spatiotemporally ephemeral food resource. However, the pallid swifts did not surf an apparent resource wave per se as would be expected in a highly mobile species, indicating that also other factors, such as spatial patchiness of resources, may influence the movement decision.","[Norevik, Gabriel; Hedenstrom, Anders; Akesson, Susanne] Lund Univ, Ctr Anim Movement Res, Dept Biol, Ecol Bldg, SE-22362 Lund, Sweden; [Boano, Giovanni] Museo Civico Storia Nat, Carmagnola, TO, Italy; [Lardelli, Roberto; Liechti, Felix] Swiss Ornithol Inst, Bird Migrat, Sempach, Switzerland","Norevik, G (corresponding author), Lund Univ, Ctr Anim Movement Res, Dept Biol, Ecol Bldg, SE-22362 Lund, Sweden.","gabriel.norevik@biol.lu.se","Akesson, Susanne/F-3175-2015; Hedenstrom, Anders/F-5377-2010","Akesson, Susanne/0000-0001-9039-2180; Liechti, Felix/0000-0001-9473-0837; Boano, Giovanni/0000-0002-2670-4351; Hedenstrom, Anders/0000-0002-1757-0945","Swedish Research CouncilSwedish Research CouncilEuropean Commission [621-2013-4361]; Linnaeus grant from the Swedish Research Council [349-2007-8690]; Lund University; Swiss federal office for environment [254, 332, 363, 400]","The project was funded by project grants to SA from the Swedish Research Council (621-2013-4361). This is a report from the Centre for Animal Movement Research (CAnMove) funded by a Linnaeus grant from the Swedish Research Council (349-2007-8690) and Lund University. The Swiss federal office for environment contributed financial support for the development of the Swiss data loggers (UTF-Nr.254, 332, 363, 400).",NA,64,7,7,2,22,"WILEY","HOBOKEN","111 RIVER ST, HOBOKEN 07030-5774, NJ USA","0030-1299","1600-0706",NA,"OIKOS","Oikos","MAY",2019,"128","5",NA,NA,NA,NA,"640","648",NA,"10.1111/oik.05531",NA,NA,9,"Ecology","Environmental Sciences & Ecology","HW2XZ","WOS:000466555000003",NA,NA,NA,NA,"2021-09-23",NA
"56","J","Weintraub, SR; Cole, RJ; Schmitt, CG; All, JD",NA,NA,NA,"Weintraub, Samantha R.; Cole, Rebecca J.; Schmitt, Carl G.; All, John D.",NA,NA,"Climatic controls on the isotopic composition and availability of soil nitrogen across mountainous tropical forest","ECOSPHERE",NA,NA,"English","Article",NA,NA,NA,NA,NA,"climate change; Costa Rica; montane tropics; nitrogen cycle; Parque Internacional La Amistad","LEAF-LITTER DECOMPOSITION; RAIN-FOREST; NUTRIENT LIMITATION; CARBON-DIOXIDE; OXIDE FLUXES; ELEVATION GRADIENT; TREE GROWTH; TEMPERATURE; EMISSIONS; METHANE","While tropical forests play a critical role in global carbon (C) and nitrogen (N) cycles, how their biogeochemical dynamics will respond to changes in climate, especially warming, is uncertain. To shed light on links between climate and N cycling in tropical forests, we measured bulk surface soil C and N concentrations and isotopic content at 40 forested sites spanning an 1800 m elevation transect in Central America, possessing wide variation in mean annual temperature (MAT; range = 10 degrees C) and precipitation (MAP; range = 1.2 m). Climate and terrain attributes were extracted from gridded data sets and regressed against soil variables, and then, empirical relationships were combined with a mass balance model to scale up to the larger landscape. Across the remote study region, elevation and soil delta N-15 values displayed a strong negative relationship, while elevation was positively related to percent of soil C, N, and C: N ratios. As elevation was tightly correlated with MAT and MAP, soil chemical and isotopic content varied strongly with climate. For example, for every degree increase in MAT, soil delta N-15 values-an indicator of relative gaseous N losses-increased by a factor of 0.4, and soil C: N ratios, which affect net N mineralization and N availability, declined by a factor of 1.1. With the 40 sites binned into bioclimatic life zones, montane, premontane, and wet-premontane transition forests showed distinct clustering of soil chemical and isotopic properties, yet forest type alone explained less variation compared to continuous elevation-climate parameters. Results of the spatially applied N-15 mass balance model implied shifts in the contribution of gaseous-to-total N loss, from 10% or less in cool, wet high-elevation forests to upwards of 60% at warmer, drier, low-elevation sites. Climate variation was thus associated with significant shifts in N dynamics across this montane tropical region, yet more work is needed to decouple direct vs. indirect climatic controls. While the mechanisms deserve further study, observed shifts in indicators of N availability and gaseous loss may be useful in managing and modeling tropical forests under climate change.","[Weintraub, Samantha R.; Cole, Rebecca J.] Univ Colorado, Inst Arctic & Alpine Res, Boulder, CO 80303 USA; [Schmitt, Carl G.] Natl Ctr Atmospher Res, Mesoscale & Microscale Meteorol Div, Boulder, CO 80301 USA; [All, John D.] Western Kentucky Univ, Dept Geog & Geol, Bowling Green, KY 42101 USA; [Weintraub, Samantha R.] Natl Ecol Observ Network, 1685 38th St,100, Boulder, CO 80301 USA; [Cole, Rebecca J.] Univ Hawaii Manoa, Dept Nat Resources & Environm Management, Hilo, HI 96720 USA","Weintraub, SR (corresponding author), Univ Colorado, Inst Arctic & Alpine Res, Boulder, CO 80303 USA.; Weintraub, SR (corresponding author), Natl Ecol Observ Network, 1685 38th St,100, Boulder, CO 80301 USA.","weintrsr@colorado.edu","Schmitt, Carl G/P-5490-2015","All, John/0000-0002-1401-971X; Schmitt, Carl/0000-0003-3829-6970","ACSP volunteers; NSF Postdoctoral FellowshipNational Science Foundation (NSF) [NSF 10-02586]","We thank Marvin Lopez Morales and two indigenous guides for their assistance executing the difficult cross-Talamanca expedition. We are grateful to the staff of PILA for their assistance obtaining permits for the route. Support was provided by ACSP volunteers, who carried out the expedition and provided funding for this research. Funding was also provided by an NSF Postdoctoral Fellowship to RJC (NSF 10-02586).",NA,68,6,7,0,28,"WILEY","HOBOKEN","111 RIVER ST, HOBOKEN 07030-5774, NJ USA","2150-8925",NA,NA,"ECOSPHERE","Ecosphere","AUG",2016,"7","8",NA,NA,NA,NA,NA,NA,"e01412","10.1002/ecs2.1412",NA,NA,13,"Ecology","Environmental Sciences & Ecology","EB2RG","WOS:000387208900011",NA,"gold",NA,NA,"2021-09-23",NA
"57","J","Kupriyanov, AN; Kupriyanov, OA; Manakov, YA; Ufimtsev, VI",NA,NA,NA,"Kupriyanov, A. N.; Kupriyanov, O. A.; Manakov, Yu A.; Ufimtsev, V., I",NA,NA,"Effects of the Growth Substrate on the Restoration of Stipa capillata L. Populations on Refuse Dumps","CONTEMPORARY PROBLEMS OF ECOLOGY",NA,NA,"English","Article",NA,NA,NA,NA,NA,"Stipa capillata L; refuse dumps; fertile topsoil; potentially fertile undersoil; herbal&#8211; seed mixture; naturelike communities",NA,"A 5-year-long experiment was carried out to assess the possibility of creating a naturelike community of meadow-steppe plant species with the predomination of Stipa capillata L. on the overburden dump of the Vinogradovskii coal pit in Kemerovo oblast. The dump preparation involved leveling the technogenic eluvium and its subsequent covering with (1) a 10-cm layer of fertile topsoil (FTS) taken from heaps of soil removed and piled prior to the dump formation or (2) a 10-cm layer of potentially fertile undersoil (PFUS) consisting of loesslike loam from the overburden dump. A flat site on a sandstone dump with a lithogenically undeveloped soil layer without the application of FTS or PFUS was used as the control. The herbal-seed mixture (HSM) was procured in summer and fall in Bachatskie Sopki regional botanical reserve on steppe slopes, whose vegetation is constituted by meadow-steppe plant communities with the predomination of S. capillata. The experimental and control sites were monitored for 5 years, from 2015 to 2019. The variant with loamy undersoil provides the best conditions for the growth and development of S. capillata: some individuals start blossoming as early as in the first year; in the third year, all plants blossom and fruit; and, in the fifth year, the share of S. capillata in the total productivity amounts to 83.6%. The plants form a thick sod layer and successfully compete with weeds. In the variant with FTS, the share of S. capillata was 4-8% in 2015-2018 and reached 30.1% only in 2019. The suppression of S. capillata in this variant is caused by the high competitiveness of the species Elytrigia repens (L.) Nevski, whose rhizomes were brought to the dump together with FTS from the soil heaps. In the control variant, an S. capillata community was noted in the fifth-fourth years; apparently, it originates from seeds dispersed from the experimental variants.","[Kupriyanov, A. N.; Kupriyanov, O. A.; Manakov, Yu A.; Ufimtsev, V., I] Russian Acad Sci, Siberian Branch, Fed Res Ctr Coal & Coal Chem, Kuzbass Bot Garden, Kemerovo 650055, Russia","Kupriyanov, AN (corresponding author), Russian Acad Sci, Siberian Branch, Fed Res Ctr Coal & Coal Chem, Kuzbass Bot Garden, Kemerovo 650055, Russia.","kupr-42@yandex.ru",NA,NA,"OAO KTK on the basis of UNU KuzBS Introduction Foundation [USU 508670]","This work was carried out thanks to the long-term support of OAO KTK on the basis of UNU KuzBS Introduction Foundation no. USU 508670.",NA,31,0,0,0,0,"MAIK NAUKA/INTERPERIODICA/SPRINGER","NEW YORK","233 SPRING ST, NEW YORK, NY 10013-1578 USA","1995-4255","1995-4263",NA,"CONTEMP PROBL ECOL+","Contemp. Probl. Ecol.","MAR",2021,"14","2",NA,NA,NA,NA,"193","200",NA,"10.1134/S1995425521020062",NA,NA,8,"Ecology","Environmental Sciences & Ecology","RY2EY","WOS:000647731600009",NA,NA,NA,NA,"2021-09-23",NA
"58","J","Funk, JL; Standish, RJ; Stock, WD; Valladares, F",NA,NA,NA,"Funk, Jennifer L.; Standish, Rachel J.; Stock, William D.; Valladares, Fernando",NA,NA,"Plant functional traits of dominant native and invasive species in mediterranean-climate ecosystems","ECOLOGY",NA,NA,"English","Article",NA,NA,NA,NA,NA,"annual; drought avoidance; functional traits; perennial; resource acquisition; resource-use efficiency; stress tolerance","WATER; PLASTICITY; PHYSIOLOGY; IMPACTS; SCALE","The idea that dominant invasive plant species outperform neighboring native species through higher rates of carbon assimilation and growth is supported by several analyses of global data sets. However, theory suggests that native and invasive species occurring in low-resource environments will be functionally similar, as environmental factors restrict the range of observed physiological and morphological trait values. We measured resource-use traits in native and invasive plant species across eight diverse vegetation communities distributed throughout the five mediterranean-climate regions, which are drought prone and increasingly threatened by human activities, including the introduction of exotic species. Traits differed strongly across the five regions. In regions with functional differences between native and invasive species groups, invasive species displayed traits consistent with high resource acquisition; however, these patterns were largely attributable to differences in life form. We found that species invading mediterranean-climate regions were more likely to be annual than perennial: three of the five regions were dominated by native woody species and invasive annuals. These results suggest that trait differences between native and invasive species are context dependent and will vary across vegetation communities. Native and invasive species within annual and perennial groups had similar patterns of carbon assimilation and resource use, which contradicts the widespread idea that invasive species optimize resource acquisition rather than resource conservation.","[Funk, Jennifer L.] Chapman Univ, Schmid Coll Sci & Technol, Orange, CA 92866 USA; [Standish, Rachel J.] Univ Western Australia, Sch Plant Biol, Crawley, WA, Australia; [Standish, Rachel J.] Murdoch Univ, Sch Vet & Life Sci, Murdoch, WA 6150, Australia; [Stock, William D.] Edith Cowan Univ, Ctr Ecosyst Management, Joondalup, WA 6027, Australia; [Valladares, Fernando] CSIC, Museo Nacl Ciencias Nat, E-28006 Madrid, Spain; [Valladares, Fernando] Univ Rey Juan Carlos, Dept Ciencias, Madrid, Spain","Funk, JL (corresponding author), Chapman Univ, Schmid Coll Sci & Technol, Orange, CA 92866 USA.","jlfunk@chapman.edu","Standish, Rachel J/B-1028-2011; Funk, Jennifer/AAX-9325-2021; Funk, Jennifer/AAL-6185-2021","Funk, Jennifer/0000-0002-1916-5513","National Science FoundationNational Science Foundation (NSF) [OISE-1132994]; Stanford UniversityStanford University; Australian Research Council Centre of Excellence for Environmental DecisionsAustralian Research Council","We thank F. Perez, M. Vila, C. Allen, T. Morald, M. Nguyen, A. Ortega, and K. Kariman for help in the lab and field, J. Larson for comments on the manuscript, and M. Macpherson for statistical advice. This work was supported by the National Science Foundation (grant OISE-1132994) and a Jasper Ridge Restoration Fellowship from Stanford University to J. L. Funk. R. J. Standish was supported by the Australian Research Council Centre of Excellence for Environmental Decisions. J. L. Funk and R. J. Standish conceived and designed the study. R. J. Standish, W. D. Stock, and F. Valladares conducted field work and contributed to writing. J. L. Funk was the primary writer. The authors declare no conflict of interest.",NA,46,75,76,8,104,"WILEY","HOBOKEN","111 RIVER ST, HOBOKEN 07030-5774, NJ USA","0012-9658","1939-9170",NA,"ECOLOGY","Ecology","JAN",2016,"97","1",NA,NA,NA,NA,"75","83",NA,"10.1890/15-0974.1",NA,NA,9,"Ecology","Environmental Sciences & Ecology","DD3VZ","WOS:000369852600010",27008777,"hybrid, Green Published",NA,NA,"2021-09-23",NA
"59","J","Browne, MA; Brooks, PR; Clough, R; Fisher, AS; Pinto, MM; Crowe, TP",NA,NA,NA,"Browne, Mark Anthony; Brooks, Paul R.; Clough, Robert; Fisher, Andrew S.; Pinto, Mariana Mayer; Crowe, Tasman P.",NA,NA,"Simulating regimes of chemical disturbance and testing impacts in the ecosystem using a novel programmable dosing system","METHODS IN ECOLOGY AND EVOLUTION",NA,NA,"English","Article",NA,NA,NA,NA,NA,"assemblage; cell; ecologically relevant; environmentally relevant; filtration; in situ; levels of biological organization; multiple stressors; pollution","MYTILUS-EDULIS; COPPER; FIELD; MUSSEL; SUSCEPTIBILITY; INCUBATION; HEMOCYTES; EXPOSURE; QUALITY","1. Pollution is a global issue at the frontier between ecology, environmental science, management, engineering and policy. Legislation requires experiments to determine how much contamination an ecosystem can absorb before there are structural or functional changes. Yet, existing methods cannot realistically simulate regimes of chemical disturbance and determine impacts to assemblages in ecosystems. This is because they lack ecologically relevant species and biotic interactions, are logistically difficult to set up and lack environmentally relevant regimes of chemical and abiotic disturbance that organisms experience in polluted areas. 2. We solved these long-standing environmental, logistical, experimental and ecological problems by developing a programmable dosing system. This dosing system simulates, in situ, regimes of chemical disturbance to assemblages by manipulating the concentration, duration, timing and frequency of pollutants to which they are exposed. 3. Experiments with priority pollutants (the metal copper and the biocide chlorpyrifos) and mussel assemblages revealed consistent plumes of contamination within patches of mussel. Mussels at the sources of experimental plumes of copper created by the dosing system, accumulated 670% more copper in their tissues compared to mussels 0.5-50 m away. In addition, when mussels were exposed to increasing concentrations of copper, there was a concomitant increase in the amount of copper in the tissues of mussels. Combining the dosing system with an established hierarchy of ecotoxicological assays revealed mussel assemblages exposed to copper and/or chlorpyrifos had 40-70% fewer worms, whilst chlorpyrifos alone caused an 81% reduction in the number of amphipods and caused mussels to filter 48% fewer particles from the water. Combinations of copper and/or chlorpyrifos had no effects on the abundance of crabs, the respiratory functions of assemblages or the viability of molluscan haemocytes. 4. As global contamination accelerates, we discuss how this technological advance will enable a diverse array of ecologists, mangers and policy-makers to understand and reduce pollution.","[Browne, Mark Anthony; Brooks, Paul R.; Crowe, Tasman P.] Univ Coll Dublin, Sci Ctr West, Sch Biol & Environm Sci, Dublin 4, Ireland; [Browne, Mark Anthony; Pinto, Mariana Mayer] Univ Sydney, Sch Biol Sci, Ctr Res Ecol Impacts Coastal Cities, Sydney, NSW 2006, Australia; [Browne, Mark Anthony; Pinto, Mariana Mayer] Univ New S Wales, Sch Biol Earth & Environm Sci, Evolut & Ecol Res Ctr, Sydney, NSW 2052, Australia; [Browne, Mark Anthony] Univ Calif Santa Barbara, Natl Ctr Ecol Anal & Synth, 735 State St,Suite 300, Santa Barbara, CA 93101 USA; [Clough, Robert; Fisher, Andrew S.] Univ Plymouth, Sch Geog Earth & Environm Sci, Portland Sq, Plymouth PL4 8AA, Devon, England","Browne, MA (corresponding author), Univ Coll Dublin, Sci Ctr West, Sch Biol & Environm Sci, Dublin 4, Ireland.; Browne, MA (corresponding author), Univ Sydney, Sch Biol Sci, Ctr Res Ecol Impacts Coastal Cities, Sydney, NSW 2006, Australia.; Browne, MA (corresponding author), Univ New S Wales, Sch Biol Earth & Environm Sci, Evolut & Ecol Res Ctr, Sydney, NSW 2052, Australia.; Browne, MA (corresponding author), Univ Calif Santa Barbara, Natl Ctr Ecol Anal & Synth, 735 State St,Suite 300, Santa Barbara, CA 93101 USA.","m.browne@unsw.edu.au",NA,"Browne, Mark Anthony/0000-0002-7508-1015; Mayer-Pinto, Mariana/0000-0001-9679-7023; Brooks, Paul/0000-0002-8105-0813","Irish Research Councils (IRC-SET, IRCHSS); UCD's Graduate Research Education Programme (GREP) in Sustainable Development; IRCSET Post-Doctoral FellowshipIrish Research Council for Science, Engineering and Technology; UCD's GREP on Sustainable Development","Equipment was purchased through funding by Irish Research Councils (IRC-SET, IRCHSS) and UCD's Graduate Research Education Programme (GREP) in Sustainable Development. MAB was supported by an IRCSET Post-Doctoral Fellowship and PRB by UCD's GREP on Sustainable Development. We thank D. Offer and staff at Malahide Marina, D. Howard (permission), F. Moreira, R. A. Coleman (discussions about work), B. Panayatakos (fabricating manifolds), K. Kupper, C. Coady (wiring), E. Boston, P. O'Callaghan, J. Kochmann, G.B. Boots, C. Gollety, S. Saloni, S. Mascolino, P. Fanning and J. Coughlan (field assistance).",NA,36,4,4,0,11,"WILEY","HOBOKEN","111 RIVER ST, HOBOKEN 07030-5774, NJ USA","2041-210X","2041-2096",NA,"METHODS ECOL EVOL","Methods Ecol. Evol.","MAY",2016,"7","5",NA,NA,NA,NA,"609","618",NA,"10.1111/2041-210X.12521",NA,NA,10,"Ecology","Environmental Sciences & Ecology","DP8FC","WOS:000378732500012",NA,"Bronze, Green Submitted",NA,NA,"2021-09-23",NA
