"29","J","Lewis, TC; Melo, M; de Lima, RF; Bremner-Harrison, S",NA,NA,NA,"Lewis, Thomas C.; Melo, Martim; de Lima, Ricardo F.; Bremner-Harrison, Samantha",NA,NA,"Habitat associations of the critically endangered Sao Tome Fiscal Lanius newtoni: Comparing standard and playback-confirmed point counts","AFRICAN JOURNAL OF ECOLOGY",NA,NA,"English","Article",NA,NA,NA,NA,NA,NA,"ALTITUDINAL GRADIENT; SPECIES RICHNESS; SHRIKE; MERIDIONALIS; DIET",NA,"[Lewis, Thomas C.; Bremner-Harrison, Samantha] Nottingham Trent Univ, Sch Anim Rural & Environm Sci, Southwell, England; [Melo, Martim] Univ Porto, Ctr Invest Biodiversidade & Recursos Genet, CIBIO, InBio,Lab Associado, Vairao, Portugal; [Melo, Martim] Univ Cape Town, DST NRF Ctr Excellence, Fitzpatrick Inst, Cape Town, South Africa; [de Lima, Ricardo F.] Univ Lisbon, Fac Ciencias, Ctr Ecol Evolut & Environm Changes Ce3C, Lisbon, Portugal; [de Lima, Ricardo F.] Associacao Monte Pico, Monte Cafe, Sao Tome & Prin","Lewis, TC (corresponding author), Nottingham Trent Univ, Sch Anim Rural & Environm Sci, Southwell, England.","tomclewis29@gmail.com","Melo, Martim/L-7704-2013; de Lima, Ricardo Faustino/C-2826-2011","Melo, Martim/0000-0003-1394-4361; de Lima, Ricardo Faustino/0000-0002-0184-3945; Bremner-Harrison, Samantha/0000-0003-4770-1376","BirdLife International; Royal Society for the Protection of Birds; Disney Worldwide Conservation Fund; U.S. Fish and Wildlife Service Critically Endangered Animals Conservation Fund [AFR-141 1 - F14AP00529]; Mohammed bin Zayed Society Species Conservation Fund [13256311]; Nottingham Trent University; Chester Zoo; Portuguese Government's Science and Technology Foundation [SFRH/BPD/91494/2012, SFRH/BPD/100614/2014]","BirdLife International; Royal Society for the Protection of Birds; Disney Worldwide Conservation Fund; U.S. Fish and Wildlife Service Critically Endangered Animals Conservation Fund, Grant/Award Number: AFR-141 1 - F14AP00529; Mohammed bin Zayed Society Species Conservation Fund, Grant/Award Number: 13256311; Nottingham Trent University; Chester Zoo; Portuguese Government's Science and Technology Foundation, Grant/Award Number: SFRH/BPD/91494/2012, SFRH/BPD/100614/2014",NA,35,1,1,0,7,"WILEY","HOBOKEN","111 RIVER ST, HOBOKEN 07030-5774, NJ USA","0141-6707","1365-2028",NA,"AFR J ECOL","Afr. J. Ecol.","JUN",2018,"56","2",NA,NA,NA,NA,"404","408",NA,"10.1111/aje.12445",NA,NA,5,"Ecology","Environmental Sciences & Ecology","GI0DQ","WOS:000434040000033",NA,NA,NA,NA,"2021-09-23",NA
"30","J","Davis, KT; Higuera, PE; Sala, A",NA,NA,NA,"Davis, Kimberley T.; Higuera, Philip E.; Sala, Anna",NA,NA,"Anticipating fire-mediated impacts of climate change using a demographic framework","FUNCTIONAL ECOLOGY",NA,NA,"English","Review",NA,NA,NA,NA,NA,"alternative stable state; climate change; conifer forest; fire; fire effects; postfire regeneration; vegetation shift; western North America","INDUCED TREE MORTALITY; SOIL BURN SEVERITY; LODGEPOLE PINE; SIERRA-NEVADA; FOREST-FIRE; SEEDLING ESTABLISHMENT; POSTFIRE REGENERATION; 20TH-CENTURY SHIFTS; DISTURBANCE REGIMES; POSTGLACIAL CLIMATE","1. Climate change indirectly affects forest ecosystems through changes in the frequency, size, and/or severity of wildfires. In addition to its direct effects prior to fire, climate also influences immediate postfire recruitment, with consequences for future vegetation structure and fire activity. A major uncertainty, therefore, is if, when and where vegetation shifts will occur. 2. With an emphasis on species traits, we use a demographic framework to examine how the interaction of changing climate and fire will affect postfire woody vegetation recruitment and the likelihood of vegetation shifts. Each demographic stage - adult mortality, propagule availability, seed germination, seedling establishment, and seedling survival - serves as a filter through which a species must pass for establishment and recovery to occur. 3. We apply this framework to case studies in western North American forests, including boreal and southwestern U.S. Pinus ponderosa forests, to help understand the mechanisms behind recent postfire vegetation changes. The case studies highlight how changes in climate and fire properties will make it increasingly difficult for some species to pass through each demographic filter in the future. 4. As climate warming continues, we expect increased dominance of species that resprout following fire, maintain canopy or soil seed banks, have long distance seed dispersal, produce drought-tolerant seedlings, and/or reach reproductive maturity quickly. The persistence of postfire vegetation shifts will depend the on ratio of recovery time to disturbance interval(s). 5. An advantage of the demographic-filter framework is that it places emphasis on mechanisms, thus improving our ability to anticipate future vegetation shifts. As such, it highlights the clear need for more mechanistic studies of postfire recruitment to disentangle the relative effects of multiple drivers in postfire environments.","[Davis, Kimberley T.; Higuera, Philip E.] Univ Montana, Dept Ecosyst & Conservat Sci, 32 Campus Dr, Missoula, MT 59812 USA; [Sala, Anna] Univ Montana, Div Biol Sci, Missoula, MT 59812 USA","Davis, KT (corresponding author), Univ Montana, Dept Ecosyst & Conservat Sci, 32 Campus Dr, Missoula, MT 59812 USA.","kimberley.davis@umontana.edu","Higuera, Philip Edward/B-1330-2010; Davis, Kimberley Taylor/A-4797-2017","Higuera, Philip Edward/0000-0001-5396-9956; Davis, Kimberley Taylor/0000-0001-9727-374X","National Science FoundationNational Science Foundation (NSF) [BCS 1461576]; Joint Fire Science Program [15-1-07-30, 16-1-01-15]","National Science Foundation, Grant/Award Number: BCS 1461576; Joint Fire Science Program, Grant/Award Number: 15-1-07-30 and 16-1-01-15",NA,174,26,26,1,51,"WILEY","HOBOKEN","111 RIVER ST, HOBOKEN 07030-5774, NJ USA","0269-8463","1365-2435",NA,"FUNCT ECOL","Funct. Ecol.","JUL",2018,"32","7",NA,NA,NA,NA,"1729","1745",NA,"10.1111/1365-2435.13132",NA,NA,17,"Ecology","Environmental Sciences & Ecology","GL6GI","WOS:000437281100008",NA,"Bronze",NA,NA,"2021-09-23",NA
"31","J","Chades, I; Pascal, LV; Nicol, S; Fletcher, CS; Ferrer-Mestres, J",NA,NA,NA,"Chades, Iadine; Pascal, Luz V.; Nicol, Sam; Fletcher, Cameron S.; Ferrer-Mestres, Jonathan",NA,NA,"A primer on partially observable Markov decision processes (POMDPs)","METHODS IN ECOLOGY AND EVOLUTION",NA,NA,"English","Review; Early Access",NA,NA,NA,NA,NA,"AI; decisions; partially observable Markov decision processes; stochastic dynamic programming; uncertainty","ADAPTIVE MANAGEMENT; ECOLOGICAL-SYSTEMS; TRANSITION MODELS; VALUE-ITERATION; STATE; UNCERTAINTY","Partially observable Markov decision processes (POMDPs) are a convenient mathematical model to solve sequential decision-making problems under imperfect observations. Most notably for ecologists, POMDPs have helped solve the trade-offs between investing in management or surveillance and, more recently, to optimise adaptive management problems. Despite an increasing number of applications in ecology and natural resources, POMDPs are still poorly understood. The complexity of the mathematics, the inaccessibility of POMDP solvers developed by the Artificial Intelligence (AI) community, and the lack of introductory material are likely reasons for this. We propose to bridge this gap by providing a primer on POMDPs, a typology of case studies drawn from the literature, and a repository of POMDP problems. We explain the steps required to define a POMDP when the state of the system is imperfectly detected (state uncertainty) and when the dynamics of the system are unknown (model uncertainty). We provide input files and solutions to a selected number of problems, reflect on lessons learned applying these models over the last 10 years and discuss future research required on interpretable AI. Partially observable Markov decision processes are powerful decision models that allow users to make decisions under imperfect observations over time. This primer will provide a much-needed entry point to ecologists.","[Chades, Iadine; Nicol, Sam; Ferrer-Mestres, Jonathan] CSIRO, Dutton Pk, Qld, Australia; [Pascal, Luz V.] ENSTA, Palaiseau, France; [Fletcher, Cameron S.] CSIRO, Atherton, Qld, Australia","Chades, I (corresponding author), CSIRO, Dutton Pk, Qld, Australia.","iadine.chades@csiro.au",NA,NA,"CSIRO Research Office Postdoctoral Fellowship; CSIRO MLAI Future Science Platform; CSIRO Julius Career Award","CSIRO Research Office Postdoctoral Fellowship; CSIRO MLAI Future Science Platform; CSIRO Julius Career Award",NA,87,0,0,0,0,"WILEY","HOBOKEN","111 RIVER ST, HOBOKEN 07030-5774, NJ USA","2041-210X","2041-2096",NA,"METHODS ECOL EVOL","Methods Ecol. Evol.",NA,NA,NA,NA,NA,NA,NA,NA,NA,NA,NA,"10.1111/2041-210X.13692",NA,"SEP 2021",15,"Ecology","Environmental Sciences & Ecology","UQ2NH","WOS:000695905700001",NA,NA,NA,NA,"2021-09-23",NA
"32","J","El Khoury, S; Rousseau, A; Lecoeur, A; Cheaib, B; Bouslama, S; Mercier, PL; Demey, V; Castex, M; Giovenazzo, P; Derome, N",NA,NA,NA,"El Khoury, Sarah; Rousseau, Andree; Lecoeur, Alexandre; Cheaib, Bachar; Bouslama, Sidki; Mercier, Pierre-Luc; Demey, Vanessa; Castex, Mathieu; Giovenazzo, Pierre; Derome, Nicolas",NA,NA,"Deleterious Interaction Between Honeybees (Apis mellifera) and its Microsporidian Intracellular Parasite Nosema ceranae Was Mitigated by Administrating Either Endogenous or Allochthonous Gut Microbiota Strains","FRONTIERS IN ECOLOGY AND EVOLUTION",NA,NA,"English","Article",NA,NA,NA,NA,NA,"honey bee; intracellular parasite; Nosema ceranae; endogenous probiotics; host-parasite interaction","SACCHAROMYCES-BOULARDII; IMMUNE-RESPONSE; DIETARY SUPPLEMENTATION; CLOSTRIDIUM-DIFFICILE; LACTOBACILLUS-REUTERI; PAENIBACILLUS-LARVAE; GIARDIA-INTESTINALIS; CLINICAL-EFFICACY; BEE HYMENOPTERA; INFECTION","Honey bees (Apis mellifera) are facing multiple stressors affecting their lifespan, health and productivity. Among them, Nosema ceranae is an intracellular microsporidian parasite, which plays a major impact on honey bees colonies. However, both efficiency and innocuity of current treatment against N. ceranae are being questioned, thus raising the urgent need to develop alternative prophylactic and curative strategies. Endogenous microbial communities (i.e., host microbiota) are known to play a major role in disease prevention, and more recently both bacterial and yeast strains issued from gut microbiota were observed to improve hosts resistance against intracellular parasites both in mammals and insect models. The use of probiotics in honey bee nutrition is therefore promising to treat or prevent diseases. Therefore, further investigations are needed to properly select microorganisms with probiotic properties. In an in vivo experimental infection by N. ceranae, the probiotic effect of two honeybee gut bacterial strains (Parasacchanbacter apium (PC1 sp.) and Bacillus sp. (PC2 sp.)), and two broad spectra probiotics (Bactocell (R) and Levucell SB (R)) has been measured. Both curative and prophylactic administrations were tested: honey bees infected with N. ceranae and noninfected. For the four probiotic candidates, significant increases of survival probabilities (20-30%) were measured after two weeks of treatment with the administration of 10(3) CFU/mL in sugar syrup, both in curative and prophylactic treatments. The present study shows that endogenous bacterial strains were at least as much efficient and safe than broad spectra probiotics in increasing survival in the context of experimental infection with N. ceranae. Therefore, taking advantage of beneficial host microbiota properties is a promising avenue to develop efficient and sustainable curative strategies against opportunistic diseases in honey bee colonies.","[El Khoury, Sarah; Cheaib, Bachar; Bouslama, Sidki; Mercier, Pierre-Luc; Giovenazzo, Pierre; Derome, Nicolas] Univ Laval, Inst Biol Integrat & Syst, Dept Biol, Quebec City, PQ, Canada; [Rousseau, Andree] Ctr Rech Sci Anim, Prod Apicole, Quebec City, PQ, Canada; [Lecoeur, Alexandre] Univ Paris Diderot, UFR Sci Vivant, Paris, France; [Demey, Vanessa; Castex, Mathieu] Lallemand SAS, Blagnac, France","Derome, N (corresponding author), Univ Laval, Inst Biol Integrat & Syst, Dept Biol, Quebec City, PQ, Canada.","nicolas.derome@bio.ulaval.ca",NA,"Bouslama, Sidki/0000-0001-8715-0420; Rousseau, Andree/0000-0002-2563-4849; Cheaib, Bachar/0000-0002-0325-823X","Agri-Innovation programme from Agriculture and Agri-Food CanadaAgriculture & Agri Food Canada [14-AP-247]","This work was funded with the Agri-Innovation programme from Agriculture and Agri-Food Canada. Grant number: 14-AP-247.",NA,121,19,19,2,15,"FRONTIERS MEDIA SA","LAUSANNE","AVENUE DU TRIBUNAL FEDERAL 34, LAUSANNE, CH-1015, SWITZERLAND","2296-701X",NA,NA,"FRONT ECOL EVOL","Front. Ecol. Evol.","MAY 23",2018,"6",NA,NA,NA,NA,NA,NA,NA,"58","10.3389/fevo.2018.00058",NA,NA,15,"Ecology","Environmental Sciences & Ecology","HC2XI","WOS:000451664800001",NA,"Green Accepted, gold",NA,NA,"2021-09-23",NA
"33","J","Maltchik, L; Stenert, C; Batzer, DP",NA,NA,NA,"Maltchik, Leonardo; Stenert, Cristina; Batzer, Darold Paul",NA,NA,"Can rice field management practices contribute to the conservation of species from natural wetlands? Lessons from Brazil","BASIC AND APPLIED ECOLOGY",NA,NA,"English","Article",NA,NA,NA,NA,NA,"Agricultural policies; Agricultural systems; Agroecosystem; Organic rice; Paddy fields; Sustainable farming","BIODIVERSITY CONSERVATION; ECOSYSTEM SERVICES; CULTIVATION CONTRIBUTE; ORGANIC AGRICULTURE; ANURAN DIVERSITY; INTENSIFICATION; INVERTEBRATES; PADDIES; BIRDS","A major goal of worldwide agriculture over the next 30 years will be to feed a burgeoning population of about 9 billion people. This expansion poses a great challenge because crop production is an activity that profoundly affects natural habitats and biodiversity. An interesting perspective for biodiversity conservation is the incorporation of production systems into overall conservation efforts. Rice is one of the world's major crops and Brazil is the leader in the Western Hemisphere with 35% of the cultivated area. Rice fields are sometimes considered man-made wetlands with potential values for many aquatic species. The main goal of this paper is to synthesize results of studies carried out over the past decade in rice fields of southern Brazil to identify management practices that enhance biodiversity levels in agricultural matrices. We also provide direction to environmentally-oriented legislators for implementing general strategies for rice farmers to supplement aquatic diversity of natural wetlands. Major techniques include: 1) keeping some rice fields flooded during the fallow phase; 2) increasing organic rice production to reduce the use of pesticides; 3) encouraging rice farmers to rejuvenate soils by periodically taking fields out of production; and 4) avoid draining new wetlands for rice production. Incentivizing good management practices in rice fields would transfer some of the responsibilities related to the conservation of biodiversity to production systems. (C) 2016 Gesellschaft fur Okologie. Published by Elsevier GmbH. All rights reserved.","[Maltchik, Leonardo; Stenert, Cristina] Lab Ecol & Conservat Aquat Ecosyst, Av Unisinos 950, BR-93022000 Sao Leopoldo, RS, Brazil; [Batzer, Darold Paul] Univ Georgia, Dept Entomol, Athens, GA 30602 USA","Maltchik, L (corresponding author), Lab Ecol & Conservat Aquat Ecosyst, Av Unisinos 950, BR-93022000 Sao Leopoldo, RS, Brazil.","maltchik@unisinos.br","Stenert, Cristina/AAD-6860-2020; Maltchik, Leonardo/T-2212-2019","Stenert, Cristina/0000-0002-9095-2018; Maltchik, Leonardo/0000-0002-5321-7524","Universidade do Vale do Rio dos Sinos - UNISINOS [02.00.023/00-0]; Conselho Nacional de Desenvolvimento Cientifico e Tecnologico - CNPqConselho Nacional de Desenvolvimento Cientifico e Tecnologico (CNPQ) [140101/2010-1]; Fundacao de Amparo a Pesquisa do Rio Grande do Sul - FAPERGSFundacao de Amparo a Ciencia e Tecnologia do Estado do Rio Grande do Sul (FAPERGS) [11/1149-7]; Brazilian Research Council - CNPq Research Productivity grantConselho Nacional de Desenvolvimento Cientifico e Tecnologico (CNPQ)","This research was supported by funds from Universidade do Vale do Rio dos Sinos - UNISINOS (02.00.023/00-0), Conselho Nacional de Desenvolvimento Cientifico e Tecnologico - CNPq (140101/2010-1) and Fundacao de Amparo a Pesquisa do Rio Grande do Sul - FAPERGS (11/1149-7). Leonardo Maltchik and Cristina Stenert hold a Brazilian Research Council - CNPq Research Productivity grant. We declare that data collection complied with current Brazilian laws.",NA,59,12,13,3,38,"ELSEVIER GMBH","MUNICH","HACKERBRUCKE 6, 80335 MUNICH, GERMANY","1439-1791","1618-0089",NA,"BASIC APPL ECOL","Basic Appl. Ecol.","FEB",2017,"18",NA,NA,NA,NA,NA,"50","56",NA,"10.1016/j.baae.2016.10.002",NA,NA,7,"Ecology","Environmental Sciences & Ecology","EM7GA","WOS:000395478300006",NA,NA,NA,NA,"2021-09-23",NA
"34","J","Arevalo, J; Aponte, H",NA,NA,NA,"Arevalo, Jefree; Aponte, Hector",NA,NA,"CARBON AND WATER STORAGE IN Tillandsia latifolia Meyen IN A SECTOR OF THE TILLANDSIAL LOMAS PIEDRA CAMPANA (LIMA/PERU)","ECOLOGIA APLICADA",NA,NA,"Spanish","Article",NA,NA,NA,NA,NA,"coastal desert; ecosystem service; Tillandsia latifolia; tillandsial lomas","SPATIAL-DISTRIBUTION; ATACAMA DESERT; VEGETATION","Tillandsial lomas are desert ecosystems characterized by communities composed mainly of plants of the genus Tillandsia. The role of these communities in carbon sequestration and the potential role they have in storing water in the desert plant biomass is unknown. The present study sought to quantify the amount of carbon and water stored by Tillandsia latifolia Meyen in a tillandsial lomas of Lima (Piedra Campana, Canete-Lima). To do this, all the slopes and ravines of a tillandsial sector were evaluated; aerial biomass was weighed and soil samples were collected (first 10 cm); the percentage of water and carbon stored in the biomass, and the carbon in the soil samples were measured. All the data obtained were processed using the kriging interpolation technique. Total carbon measured was 94.10 tons (t) (3.63 t/ha) with more carbon stored in the part of the soil (76.50 t) than in the aerial part (17.60 t). The amount of carbon stored by this tillandsial lomas is below that of several ecosystems that are used as compensation of CO2 emissions such as wetlands or Amazonian vegetation. On the other hand, the water stored amounted to 164 thousand liters, a value that is important as a water reserve in this desert region. The implications of the results obtained for the assessment and management of this desert ecosystem are discussed.","[Arevalo, Jefree] Univ Cient Sur, Ingn Ambiental, Fac Ciencias Ambientales, Av Antigua Carretera Panamer Sur Km 19, Lima 42, Peru; [Aponte, Hector] Univ Cient Sur, Biol Marina, Fac Ciencias Vet & Biol, Av Antigua Carretera Panamer Sur,Km 19, Lima 42, Peru; [Aponte, Hector] Univ Nacl Mayor San Marcos, Lab Florist, Dept Dicotiledoneas, Museo Hist Nat, Ave Arenales 1256,Apartado 14-0434, Lima 14, Peru","Arevalo, J (corresponding author), Univ Cient Sur, Ingn Ambiental, Fac Ciencias Ambientales, Av Antigua Carretera Panamer Sur Km 19, Lima 42, Peru.","je-free@hotmail.com; haponte@cientifica.edu.pe","Aponte, Hector/AAW-6467-2021",NA,NA,NA,NA,24,1,1,1,1,"UNIV NACIONAL AGRARIA LA MOLINA","LIMA","LA MOLINA, LIMA, 00000, PERU","1726-2216","1993-9507",NA,"ECOL APL","Ecol. Apl.","JAN-JUL",2020,"19","1",NA,NA,NA,NA,"9","15",NA,"10.21704/rea.v19i1.1441",NA,NA,7,"Ecology","Environmental Sciences & Ecology","LY2CP","WOS:000540328400002",NA,"gold",NA,NA,"2021-09-23",NA
"35","J","Dormann, CF",NA,NA,NA,"Dormann, Carsten F.",NA,NA,"The Theory of Ecological Communities. Monographs in Population Biology 57","BASIC AND APPLIED ECOLOGY",NA,NA,"English","Book Review",NA,NA,NA,NA,NA,NA,NA,NA,NA,NA,"carsten.dormann@biom.uni-freiburg.de",NA,NA,NA,NA,NA,1,0,0,1,8,"ELSEVIER GMBH, URBAN & FISCHER VERLAG","JENA","OFFICE JENA, P O BOX 100537, 07705 JENA, GERMANY","1439-1791","1618-0089",NA,"BASIC APPL ECOL","Basic Appl. Ecol.","MAR",2017,"19",NA,NA,NA,NA,NA,"94","94",NA,"10.1016/j.baae.2017.01.003",NA,NA,1,"Ecology","Environmental Sciences & Ecology","ER6NZ","WOS:000398923500011",NA,NA,NA,NA,"2021-09-23",NA
