"","Publication Type","Authors","Book Authors","Book Editors","Book Group Authors","Author Full Names","Book Author Full Names","Group Authors","Article Title","Source Title","Book Series Title","Book Series Subtitle","Language","Document Type","Conference Title","Conference Date","Conference Location","Conference Sponsor","Conference Host","Author Keywords","Keywords Plus","Abstract","Addresses","Reprint Addresses","Email Addresses","Researcher Ids","ORCIDs","Funding Orgs","Funding Text","Cited References","Cited Reference Count","Times Cited, WoS Core","Times Cited, All Databases","180 Day Usage Count","Since 2013 Usage Count","Publisher","Publisher City","Publisher Address","ISSN","eISSN","ISBN","Journal Abbreviation","Journal ISO Abbreviation","Publication Date","Publication Year","Volume","Issue","Part Number","Supplement","Special Issue","Meeting Abstract","Start Page","End Page","Article Number","DOI","Book DOI","Early Access Date","Number of Pages","WoS Categories","Research Areas","IDS Number","UT (Unique WOS ID)","Pubmed Id","Open Access Designations","Highly Cited Status","Hot Paper Status","Date of Export","...68"
"1","J","Ortiz-Alvarado, Y; Rivera-Marchand, B",NA,NA,NA,"Ortiz-Alvarado, Yarira; Rivera-Marchand, Bert",NA,NA,"Worker Queens? Behavioral Flexibility of Queens in the Little Fire AntWasmannia auropunctata","FRONTIERS IN ECOLOGY AND EVOLUTION",NA,NA,"English","Article",NA,NA,NA,NA,NA,"behavior; flexibility; invasive; ant; queen; juvenile hormone; vitellogenin","DIVISION-OF-LABOR; HONEYBEE APIS-MELLIFERA; JUVENILE-HORMONE; WASMANNIA-AUROPUNCTATA; HYMENOPTERA-FORMICIDAE; ENDOCRINE PHYSIOLOGY; TEMPORAL POLYETHISM; HARVESTER ANT; SOCIAL INSECT; ADULT WORKER","Many species of social Hymenoptera demonstrate behavioral flexibility, where older workers that typically forage can revert to younger worker tasks, such as nursing, when these are absent. This flexibility is typical of the sterile worker class, yet rare in queens. In the little fire ant (Wasmannia auropunctata), queens have been reported to perform only egg laying. We examined behavior of queens ofW. auropunctataafter demographic manipulation. When half of the workers were removed from the colony, queens were observed caring for eggs, larvae and pupae as well as eating outside of the nest, like forager workers. We examined the relationship between these atypical queen behaviors and their juvenile hormone binding protein (JHbp) and vitellogenin (Vg) expression via QRT-PCR method.JHbpandVgexpression decreased when queens were performing worker tasks, resembling the expected expression pattern of typical sterile workers. Flexibility in queen behaviors in the little fire ant may be an important adaptation to changing environments. As a significant invasive species, such adaptation may increase the probability of colony survival during propagation. Our results not only present new insights in behavioral flexibility in social insects, but also increases our understanding of the success of this significant invasive species.","[Ortiz-Alvarado, Yarira] Univ Puerto Rico, Dept Biol, San Juan, PR 00936 USA; [Rivera-Marchand, Bert] Inter Amer Univ Puerto Rico, Dept Nat Sci & Math, Bayamon, PR USA","Ortiz-Alvarado, Y (corresponding author), Univ Puerto Rico, Dept Biol, San Juan, PR 00936 USA.","y.ortizal@gmail.com",NA,"Ortiz-Alvarado, Yarira/0000-0002-3087-9293","PR-LSAMP [1026560]; Agustin Stahl fellowships; Inter American University of Puerto Rico","Financial support was provided by PR-LSAMP (grant no. 1026560) and the Agustin Stahl fellowships awarded to YO-A and the Inter American University of Puerto Rico.",NA,47,3,3,0,10,"FRONTIERS MEDIA SA","LAUSANNE","AVENUE DU TRIBUNAL FEDERAL 34, LAUSANNE, CH-1015, SWITZERLAND","2296-701X",NA,NA,"FRONT ECOL EVOL","Front. Ecol. Evol.","AUG 4",2020,"8",NA,NA,NA,NA,NA,NA,NA,"241","10.3389/fevo.2020.00241",NA,NA,9,"Ecology","Environmental Sciences & Ecology","NF4EV","WOS:000563251600001",NA,"gold",NA,NA,"2021-09-23",NA
"2","J","Jager, T",NA,NA,NA,"Jager, Tjalling",NA,NA,"Revisiting simplified DEBtox models for analysing ecotoxicity data","ECOLOGICAL MODELLING",NA,NA,"English","Article",NA,NA,NA,NA,NA,"Energy budget; DEBtox; DEBkiss; Toxicokinetic-toxicodynamic modelling; Ecotoxicity; Environmental risk assessment","ECOLOGICAL RISK-ASSESSMENT; DYNAMIC ENERGY BUDGETS; TOXICITY TESTS; EXPOSURE","Mechanistic effect models are gaining increasing interest in ecotoxicology and environmental risk assessment (ERA). For explaining effects on an individual's life-history traits (e.g., growth and reproduction), DEBtox is the leading toxicokinetic-toxicodynamic (TKTD) modelling approach. DEBtox is the application of a model based on dynamic energy budget (DEB) theory to toxic effects, but the term is generally used to refer to practical simplified models from this theoretical framework. The DEBtox approach has remained relatively unchanged over the last few decades, but an updated model is urgently needed. The need for revision is triggered by three, relative recent, developments: the broad acceptance of simple TKTD models for survival (GUTS), the development and successful application of reserve-less DEB models for invertebrates (DEBkiss), and the concrete interest in DEBtox from the field of ERA for pesticides in Europe. In this paper, an updated DEBtox model is presented that is based on DEBkiss, follows the TKTD formulation as established for GUTS (i.e., explicitly taking damage into consideration), and includes a starvation module that is essential for time-varying exposure (as some toxicant action mechanisms may induce starvation). The updated model is illustrated with a case study for springtails exposed to chlorpyrifos in food, and may find applications in science as well as in the regulatory arena.","[Jager, Tjalling] DEBtox Res, De Bilt, Netherlands","Jager, T (corresponding author), DEBtox Res, De Bilt, Netherlands.","tjalling@debtox.nl","Jager, Tjalling/D-8168-2011","Jager, Tjalling/0000-0002-4424-1442",NA,NA,NA,27,9,9,5,16,"ELSEVIER","AMSTERDAM","RADARWEG 29, 1043 NX AMSTERDAM, NETHERLANDS","0304-3800","1872-7026",NA,"ECOL MODEL","Ecol. Model.","JAN 15",2020,"416",NA,NA,NA,NA,NA,NA,NA,"108904","10.1016/j.ecolmodel.2019.108904",NA,NA,8,"Ecology","Environmental Sciences & Ecology","KM3LM","WOS:000514022500013",NA,NA,NA,NA,"2021-09-23",NA
"3","J","Tikunov, VS; Chereshnia, OY",NA,NA,NA,"Tikunov, V. S.; Chereshnia, O. Yu",NA,NA,"The pollution index and the index of the ecological tension in the regions of the Russian Federation","THEORETICAL AND APPLIED ECOLOGY",NA,NA,"Russian","Article",NA,NA,NA,NA,NA,"pollution of the atmosphere; solid waste; sewage; ecological situation; pollution index; index of the ecological tension",NA,"The article presents a methodology for a comprehensive assessment of the environmental situation in the regions of the Russian Federation based on the pollution index and the index of ecological tension. The evaluation was carried out in two stages. At the first stage the degree of pollution of the atmosphere, hydrosphere and lithosphere of the regions was estimated on the basis of emission of pollutants into the atmosphere from stationary sources, formation of solid domestic wastes (SDW), and discharge of contaminated wastewater. Based on these three indicators, a pollution index was constructed that estimates aggregate pollution level. At the second stage the authors estimated the loads generated by atmospheric emissions, solid waste, and waste water discharged into the territory of each region, per capita and in relation to the environmental capacity of the economy. This allows us to take into account the area of pollution, anthropogenic pressure, and environmental responsibility of the population, as well as the environmental friendliness of production. On the basis of relative indicators, the index of ecological tension was created. Approbation was carried out by the example of the regions of Russia for 2014. The series of maps were created based on the obtained results. With the help of the methodology, an analysis of the environmental situation was carried out, some regions with a disproportionately high environmental load were identified. The importance of specific indicators to assess the peculiar ecological footprint of each person or the production of the region is underlined.","[Tikunov, V. S.; Chereshnia, O. Yu] Lomonosov Moscow State Univ, GSP 1, Moscow 119991, Russia","Tikunov, VS (corresponding author), Lomonosov Moscow State Univ, GSP 1, Moscow 119991, Russia.","tikunov@geogr.msu.su; chereshnia.o@geogr.msu.ru","Chereshnia, Olga/AAB-6282-2019; Tikunov, Vladimir S./M-1475-2015","Chereshnia, Olga/0000-0002-5446-7111; Tikunov, Vladimir S./0000-0002-1597-6909",NA,NA,NA,8,1,1,0,0,"LLC PUBLISHING HOUSE, KAMERTON","MOSCOW","9, STROMYNKA ST, MOSCOW, 107014, RUSSIA","1995-4301","2618-8406",NA,"THEOR APPL ECOL","Theor. Appl. Ecol.",NA,2017,NA,"3",NA,NA,NA,NA,"34","38",NA,NA,NA,NA,7,"Ecology","Environmental Sciences & Ecology","VI2ZA","WOS:000468547400004",NA,NA,NA,NA,"2021-09-23",NA
"4","J","Milberg, P; Talle, M; Fogelfors, H; Westerberg, L",NA,NA,NA,"Milberg, Per; Talle, Malin; Fogelfors, Hakan; Westerberg, Lars",NA,NA,"The biodiversity cost of reducing management intensity in species-rich grasslands: Mowing annually vs. every third year (vol 22, pg 61, 2017)","BASIC AND APPLIED ECOLOGY",NA,NA,"English","Correction",NA,NA,NA,NA,NA,NA,NA,NA,"[Milberg, Per; Talle, Malin; Westerberg, Lars] Linkoping Univ, Conservat Ecol Grp, IFM Biol, SE-58183 Linkoping, Sweden; [Fogelfors, Hakan] Swedish Univ Agr Sci, Dept Crop Prod Ecol, Box 7043, SE-75007 Uppsala, Sweden","Milberg, P (corresponding author), Linkoping Univ, Conservat Ecol Grp, IFM Biol, SE-58183 Linkoping, Sweden.","permi@ifm.liu.se","Milberg, Per/G-6153-2012; Westerberg, Lars/E-7568-2015","Milberg, Per/0000-0001-6128-1051; Westerberg, Lars/0000-0001-9820-3460",NA,NA,NA,1,0,0,0,9,"ELSEVIER GMBH, URBAN & FISCHER VERLAG","JENA","OFFICE JENA, P O BOX 100537, 07705 JENA, GERMANY","1439-1791","1618-0089",NA,"BASIC APPL ECOL","Basic Appl. Ecol.","MAR",2018,"27",NA,NA,NA,NA,NA,"97","98",NA,"10.1016/j.baae.2018.02.005",NA,NA,2,"Ecology","Environmental Sciences & Ecology","GB8CW","WOS:000429303500010",NA,"Green Submitted",NA,NA,"2021-09-23",NA
"5","J","Ley, AC; Hardy, OJ",NA,NA,NA,"Ley, Alexandra C.; Hardy, Olivier J.",NA,NA,"Spatially limited clonality and pollen and seed dispersal in a characteristic climber of Central African rain forests: Haumania danckelmaniana (Marantaceae)","BIOTROPICA",NA,NA,"English","Article",NA,NA,NA,NA,NA,"Cameroon; clonality; gene dispersal distance; microsatellites; perennial climbers; Sp statistic; tropical understory","GENETIC-STRUCTURE; SPECIES-DIVERSITY; SEXUAL REPRODUCTION; LOCAL ADAPTATION; NULL ALLELES; TREE; POPULATION; FLOW; PATTERNS; PLANT","Gene dispersal and clonality are important aspects of plant evolution affecting the spatial genetic structure (SGS) and the long-term survival of species. In the tropics these parameters have mostly been investigated in trees and some herbs, but rarely in climbers which frequently: (1) show clonal growth leading to a patchy distribution pattern similar to that of understory herbs; and (2) flower in the canopy where they may have access to long-distance dispersal like canopy trees. We thus hypothesize for climbers an intermediate genetic structure between herbs and trees. The study aims at assessing breeding system and spatial extent of clonality and gene dispersal in Haumania danckelmaniana (Marantaceae), a common climber in the tropical rain forests from western Central Africa. In eastern Cameroon, 330 ramets were sampled at three spatial scales and genotyped at seven microsatellite loci. Clonality was moderate (clonal extend: 15-25 m, clonal diversity 0.4-0.65) indicating the importance of recruitment from seeds at this locality. The low inbreeding (FIS) suggested predominant outcrossing. The rate of decay of the relatedness between individuals with distance indicated limited gene dispersal distance (rg = 9-50 m, neighborhood sizes Nb = 23-67) in accordance with narrowly gravity dispersed seeds and restricted pollen transfer distance in densely flowering populations. The marked SGS (Sp = 0.011-0.026) was similar to that reported in tropical trees, but might increase with augmented clonality as in many herbs, especially under more severe disturbance regimes.","[Ley, Alexandra C.] Univ Halle Wittenberg, Inst Systemat & Biodivers, Neuwerk 21, D-06108 Halle, Saale, Germany; [Ley, Alexandra C.; Hardy, Olivier J.] Univ Libre Bruxelles, Fac Sci, Evolutionary Biol & Ecol, CP160-12,50 Ave F Roosevelt, B-1050 Brussels, Belgium","Ley, AC (corresponding author), Univ Halle Wittenberg, Inst Systemat & Biodivers, Neuwerk 21, D-06108 Halle, Saale, Germany.; Ley, AC (corresponding author), Univ Libre Bruxelles, Fac Sci, Evolutionary Biol & Ecol, CP160-12,50 Ave F Roosevelt, B-1050 Brussels, Belgium.","alexandra.ley@botanik.uni-halle.de",NA,NA,"Germany Research Foundation (DFG)German Research Foundation (DFG); Belgian Fund for Scientific Research (F.R.S-FNRS)Fonds de la Recherche Scientifique - FNRS [MIS 4.519.10, T0163.13]; Belgian Science Policy (Belspo) through project AFRIFORD","We thank the logging company Pallisco for granting access to their concession and K. Dainou and the local team for support in the forest. We are further grateful to E. Kaymak for support in genotyping some of the material and the Germany Research Foundation (DFG) for granting a 2-year postdoctoral fellowship to the first author. We thank two anonymous reviewers for their valuable comments. The laboratory work was financed by the Belgian Fund for Scientific Research (F.R.S-FNRS, grants MIS 4.519.10, T0163.13) and the Belgian Science Policy (Belspo) through project AFRIFORD.",NA,111,3,3,0,12,"WILEY","HOBOKEN","111 RIVER ST, HOBOKEN 07030-5774, NJ USA","0006-3606","1744-7429",NA,"BIOTROPICA","Biotropica","SEP",2016,"48","5",NA,NA,NA,NA,"618","627",NA,"10.1111/btp.12341",NA,NA,10,"Ecology","Environmental Sciences & Ecology","EC6VL","WOS:000388274700008",NA,NA,NA,NA,"2021-09-23",NA
"6","J","Nanni, L; Maguolo, G; Pancino, F",NA,NA,NA,"Nanni, Loris; Maguolo, Gianluca; Pancino, Fabio",NA,NA,"Insect pest image detection and recognition based on bio-inspired methods","ECOLOGICAL INFORMATICS",NA,NA,"English","Article",NA,NA,NA,NA,NA,"Pest recognition; Convolutional neural networks; Saliency methods; Classifiers ensemble","SALIENCY","Insect pests recognition is necessary for crop protection in many areas of the world. In this paper we propose an automatic classifier based on the fusion between saliency methods and convolutional neural networks. Saliency methods are famous image processing algorithms that highlight the most relevant pixels of an image. In this paper, we use three different saliency methods as image preprocessing and create three different images for every saliency method. Hence, we create 3 x 3 = 9 new images for every original image to train different convolutional neural networks. We evaluate the performance of every preprocessing/network couple and we also evaluate the performance of their ensemble. We test our approach on both a small dataset and the large IP102 dataset. Our best ensembles reaches the state of the art accuracy on both the smaller dataset (92.43%) and the IP102 dataset (61.93%), approaching the performance of human experts on the smaller one. Besides, we share our MATLAB code at: https://github.com/LorisNanni/.","[Nanni, Loris; Maguolo, Gianluca; Pancino, Fabio] Univ Padua, Via Gradenigo 6, I-35131 Padua, Italy","Maguolo, G (corresponding author), Univ Padua, Via Gradenigo 6, I-35131 Padua, Italy.","loris.nanni@unipd.it; gianluca.maguolo@phd.unipd.it; fabio.pancino@studenti.unipd.it",NA,NA,"NVIDIA Corporation","D The authors wish to acknowledge the support of NVIDIA Corporation with their donation of the GPU used in this research.",NA,25,8,8,5,19,"ELSEVIER","AMSTERDAM","RADARWEG 29, 1043 NX AMSTERDAM, NETHERLANDS","1574-9541","1878-0512",NA,"ECOL INFORM","Ecol. Inform.","MAY",2020,"57",NA,NA,NA,NA,NA,NA,NA,"101089","10.1016/j.ecoinf.2020.101089",NA,NA,8,"Ecology","Environmental Sciences & Ecology","LG6NY","WOS:000528216500018",NA,"Green Submitted",NA,NA,"2021-09-23",NA
"7","J","Gaiser, EE; Anderson, EP; Castaneda-Moya, E; Collado-Vides, L; Fourqurean, JW; Heithaus, MR; Jaffe, R; Lagomasino, D; Oehm, NJ; Price, RM; Rivera-Monroy, VH; Chowdhury, RR; Troxler, TG",NA,NA,NA,"Gaiser, Evelyn E.; Anderson, Elizabeth P.; Castaneda-Moya, Edward; Collado-Vides, Ligia; Fourqurean, James W.; Heithaus, Michael R.; Jaffe, Rudolf; Lagomasino, David; Oehm, Nicholas J.; Price, Rene M.; Rivera-Monroy, Victor H.; Chowdhury, Rinku Roy; Troxler, Tiffany G.",NA,NA,"New perspectives on an iconic landscape from comparative international long-term ecological research","ECOSPHERE",NA,NA,"English","Article",NA,NA,NA,NA,NA,"biogeochemistry; estuary; Everglades; food webs; groundwater discharge; hydrology; ILTER; karstic; LTER; mangrove; periphyton; Special Feature: International LTER; wetland","DISSOLVED ORGANIC-MATTER; EVERGLADES-NATIONAL-PARK; BOCAS-DEL-TORO; MANGROVE FORESTS; FRESH-WATER; FLORIDA BAY; PHOSPHORUS LIMITATION; SUBTROPICAL ESTUARY; HALIMEDA-INCRASSATA; SHARK BAY","Iconic ecosystems like the Florida Coastal Everglades can serve as sentinels of environmental change from local to global scales. This characteristic can help inform general theory about how and why ecosystems transform, particularly if distinctive ecosystem properties are studied over long time scales and compared to those of similar ecosystems elsewhere. Here we review the ways in which long-term, comparative, international research has provided perspectives on iconic features of the Everglades that have, in turn, informed general ecosystem paradigms. Studies in other comparable wetlands from the Caribbean to Australia have shed light on distinctive and puzzling aspects such as the upside-down estuary'' and productivity paradox'' for which the Everglades is known. These studies suggest that coastal wetlands on carbonate (karstic) platforms have: (1) hydrological and biogeochemical properties that reflect hidden'' groundwater sources of water and nutrients, (2) very productive, mat-forming algal communities that present a low-quality food to aquatic consumers that encourages (3) highly diversified feeding strategies within and among populations, and (4) extensive and productive seagrass meadows and mangrove forests that promote strong cultural dependencies associated with the ecosystem services they provide. The contribution of international research to each of these general ecological topics is discussed with a particular goal of encouraging informed decision-making in threatened wetlands across the globe.","[Gaiser, Evelyn E.; Anderson, Elizabeth P.; Collado-Vides, Ligia; Fourqurean, James W.; Heithaus, Michael R.; Jaffe, Rudolf; Oehm, Nicholas J.; Price, Rene M.; Troxler, Tiffany G.] Florida Int Univ, Southeast Environm Res Ctr, Miami, FL 33199 USA; [Gaiser, Evelyn E.; Collado-Vides, Ligia; Fourqurean, James W.; Heithaus, Michael R.; Troxler, Tiffany G.] Florida Int Univ, Dept Biol Sci, Sch Environm Arts & Soc, Miami, FL 33199 USA; [Anderson, Elizabeth P.; Price, Rene M.] Florida Int Univ, Dept Earth & Environm, Sch Environm Arts & Soc, Miami, FL 33199 USA; [Castaneda-Moya, Edward; Rivera-Monroy, Victor H.] Louisiana State Univ, Sch Coast & Environm, Dept Oceanog & Coastal Sci, Baton Rouge, LA 70803 USA; [Jaffe, Rudolf] Florida Int Univ, Dept Chem, Sch Environm Arts & Soc, Miami, FL 33181 USA; [Lagomasino, David] Univ Space Res Assoc, NASA, Goddard Space Flight Ctr, Greenbelt, MD 20771 USA; [Oehm, Nicholas J.] Florida Int Univ, STEM Transformat Inst, Miami, FL 33199 USA; [Chowdhury, Rinku Roy] Clark Univ, Grad Sch Geog, Worcester, MA 01610 USA","Gaiser, EE (corresponding author), Florida Int Univ, Southeast Environm Res Ctr, Miami, FL 33199 USA.","gaisere@fiu.edu","Fourqurean, James/AAY-9611-2020; Gaiser, Evelyn/ABG-2507-2020; Rivera-Monroy, Victor H/G-7329-2011; Lagomasino, David/P-8413-2015; Heithaus, Michael/AAF-9914-2020","Fourqurean, James/0000-0002-0811-8500; Gaiser, Evelyn/0000-0003-2065-4821; Lagomasino, David/0000-0003-4008-5363; Heithaus, Michael/0000-0002-3219-1003; Price, Rene/0000-0003-1050-7270; Oehm, Jr., Nicholas J./0000-0001-9013-6750; Castaneda, Edward/0000-0001-7759-4351","Florida Coastal Everglades Long-Term Ecological Research program through U.S. National Science Foundation [DEB-9910514, DBI-0620409, DEB-1237517]; NSFNational Science Foundation (NSF) [OCE0745606, OCE526065]; George Barley Chair; National Aeronautics and Space Administration's Water Science of Coupled Aquatic Processes in Ecosystems from Space (WaterSCAPES) University Research Center program [NNX-10AQ13]; Consejo Nacional de Ciencia y Tecnologia (CONACyT)Consejo Nacional de Ciencia y Tecnologia (CONACyT) [CONACyT-Fondo Institucional: I0002, 24847, Etapa: 001]; NASA-JPL project (LSU Subcontract) [1452878]; Southeast Environmental Research Center at FIU [748]; Division Of Environmental BiologyNational Science Foundation (NSF)NSF - Directorate for Biological Sciences (BIO) [1237517] Funding Source: National Science Foundation","This paper was stimulated by conversations at the 2013 meeting of the International Long-Term Ecological Research Network in Seoul, Korea. Research in the Everglades was supported by the Florida Coastal Everglades Long-Term Ecological Research program through U.S. National Science Foundation grants (DEB-9910514, DBI-0620409, and DEB-1237517), and initial research in Australia, Belize and Mexico by international supplements to this program. Subsequent research in Australia was supported by NSF Grant OCE0745606 and OCE526065, and international research on organic matter dynamics benefited from additional support of the George Barley Chair (to R. Jaffe). Geochemical research in the Sian Ka'an Biosphere Reserve was provided by the National Aeronautics and Space Administration's Water Science of Coupled Aquatic Processes in Ecosystems from Space (WaterSCAPES) University Research Center program under Grant No. NNX-10AQ13. Student travel support was made available from the Latin American Caribbean program and Christina Menendez Foundation at Florida International University (FIU). Partial funding for VHRM participation was provided by the Consejo Nacional de Ciencia y Tecnologia (CONACyT) to the Red Mex-LTER program (CONACyT-Fondo Institucional: I0002; Proyecto# 24847, Etapa: 001) through the project Demandas Hidrologicas de los Ecosistemas Naturales en Mexico: Fase 1'' and the NASA-JPL project (LSU Subcontract# 1452878) Vulnerability Assessment of Mangrove Forest Regions of the Americas''. This is contribution number 81 of the Shark Bay Ecosystem Research Project 748 of the Southeast Environmental Research Center at FIU.",NA,124,6,6,2,31,"WILEY","HOBOKEN","111 RIVER ST, HOBOKEN 07030-5774, NJ USA","2150-8925",NA,NA,"ECOSPHERE","Ecosphere","OCT",2015,"6","10",NA,NA,NA,NA,NA,NA,"181","10.1890/ES14-00388.1",NA,NA,18,"Ecology","Environmental Sciences & Ecology","CV1NF","WOS:000364024300010",NA,"gold",NA,NA,"2021-09-23",NA
